LABEL,Date,Source,Title,Headline
sports,2023-02-01,CNN,Coca Cola s Powerade is taking a jab at Gatorade with new formula and packaging,Gatorade long been leader among sports drinks those brightly colored beverages designed replenish electrolytes lost when sweat rival Powerade hoping that revamped recipe look will help finally unseat Gatorade from
sports,2023-02-04,Wired,China s XPeng G Could Be the Best Electric SUV Around,good value with premium feel lots space XPeng challenge more established automakers West
sports,2023-01-21,The Guardian,Get active of the best sportswear for men and women in pictures,Shape colourful sports gear that rely Continue reading
sports,2023-01-31,Engadget,Peacock stops offering its free tier to new subscribers,Peacock stopped offerings free tier customers first reported Streamable potential subscribers visit Peacock website will only ways access platform Peacock Premium Premium Plus Either
sports,2023-01-17,Reuters,Saudi Arabia launches Events Investment Fund SPA reports Reuters,Saudi Arabia launched investment fund support culture tourism entertainment sports industries state news agency reported Tuesday
sports,2023-02-01,Reuters,Premier League clubs spend bln for first time in January transfer Reuters,Premier League soccer clubs spent record million pounds billion January transfer window analysis from Deloitte Sports Business Group said Wednesday
sports,2023-02-13,Engadget,Comcast is ending free Peacock access for Xfinity subscribers,Comcast subscribers about lose perk free access Peacock streaming Since launched April supported version Peacock Premium been provided Xfinity broadband customers charge Starting April
sports,2023-01-27,Lifehacker.com,Grammar Mistakes Your Probably Making Every Day I Did That on Purpose,grammar purist Trying nail English down particular rules will leave heartbroken muttering supposed items fewer disinterested supermarket checker Language changes constantly belongs
sports,2023-01-19,Reuters,Top Indian wrestlers accuse sports body chief of sexual harassment Reuters India,Olympic medal winning Indian wrestlers have accused chief their sport governing body coaches sexually harassing female players have vowed protest until federation disbanded head investigated
sports,2023-02-11,The Guardian,Going up and up UK padel and pickleball boom drives sales bounce,Surge participation since burgeoning market specialist rackets paddles ballsPadel pickleball racket sport mashups combining elements tennis squash badminton whole ballgame with sales
sports,2023-02-03,Business Insider,Division I university cheerleaders refuse to perform at basketball game after getting ignored on Women in Sports Day,John University cheerleaders wore WOMEN SPORTS shirts Wednesday basketball game against Seton Hall protest
sports,2023-01-30,VentureBeat,Sorare partners with Premier League for Web fantasy sports,Sorare English Premier League have struck deal release cards based fantasy sports title
sports,2023-01-18,The Guardian,UK sports facilities face closure without government help warn leading bodies,Government urged change decision energy discount This will impact millions people ages backgrounds government must reverse decision exclude swimming pools from energy discount scheme face natio
sports,2023-01-30,The Guardian,JD Sports hit by cyber attack that leaked m customers data,Retail group says incident affected shoppers Size Millets Blacks Scotts Millets Sport brandsThe fashion retailer Sports said personal financial information million customers potentially accessed hackers cyber attack
sports,2023-01-18,Reuters,Former Fox execs conspired to bribe FIFA officials prosecution Reuters,Argentine businessman testified Wednesday that former Century executives sports marketing company conspired with bribe South American soccer officials secure lucrative broadcasting rights
sports,2023-01-31,Reuters,Russia says it would welcome moves to allow its athletes at Olympics Reuters,Russia said Tuesday would welcome moves International Olympic Committee allow athletes compete Olympics after world sports body looked options their return international events
sports,2023-01-30,Reuters,Premier League signs NFT deal with SoftBank backed Sorare Reuters,Premier League partnering with French fantasy sports platform Sorare sell fungible tokens NFTs sign that sporting world continuing embrace digital assets despite rout markets
sports,2023-02-02,Reuters,New Zealand says FIFA should factor empowering women in Reuters,Zealand sports minister Grant Robertson said FIFA should consider empowerment women girls when making commercial arrangements amid reports Saudi Arabia tourism sponsor Women World
sports,2023-01-31,Reuters,Analysis Italy promotes short term job market shunning Spain s Reuters,Marta Pizza year swimming instructor worked Rome sports centre last years earning euros hour with pension contributions sick holidays
sports,2023-01-17,Reuters,What s faster than a Corvette A Vette with an electric motor Reuters,General Motors href https reuters companies target blank Tuesday revealed hybrid Corvette sports that uses electric motor battery acceleration snow
sports,2023-01-27,Reuters,Alfa Romeo F team announce co title partnership with Stake Reuters com,Alfa Romeo Formula team announced multi year title partnership with online casino sports betting platform Stake Friday previous Polish sponsor Orlen switched rivals AlphaTauri
sports,2023-01-24,Reuters,Factbox Mikaela Shiffrin breaks Lindsey Vonn s women s World Cup Reuters,Factbox Mikaela Shiffrin href lifestyle sports shiffrin passes vonn become time womans world winner broke compatriot Lindsey Vonn women World record clinching victory Tuesday
sports,2023-02-03,CNN,Ford is getting back into Formula racing to help sell EVs,America major automakers getting back into Formula racing Following General Motors recent announcement that applying along with Andretti Global field team prestigious racing series Ford announced that getting back
sports,2023-02-10,CNET,My Year Old LeBron Overrated Tweet Has Returned to Haunt Me CNET,Commentary epically post from more than decade been resurrected Sports Twitter over
sports,2023-02-09,NPR,Plan to collect menstrual data on high school athletes in Florida is voted down,Florida High School Athletic Association board directors votes remove questions about athletes menstrual history from required health form participation school sports
sports,2023-01-28,Business Insider,Kanye West named a suspect in a battery investigation after a video appeared to show him throwing a woman s phone report says,According report published Friday incident occurred near sports complex where West daughter North basketball game
sports,2023-02-13,The Guardian,Mikaela Shiffrin leads push for winter sports sustainability amid climate crisis,American skier wants make sport climate neutral Letter signed Shiffrin scores others sent star Mikaela Shiffrin calls chiefs change their approach sustainability make winter
sports,2023-01-19,BBC News,Wrestler Vinesh Phogat accuses WFI chief other coaches of sexual misconduct,Women athletes have accused chief India wrestling federation sexual misconduct
sports,2023-02-06,Android Central,Is the Galaxy S Ultra finally better at taking photos of moving objects,Samsung Galaxy Ultra sports bunch sensors they take pictures kids pets other moving objects better than previous Samsung phones test that here
sports,2023-02-03,Lifehacker.com,Make Pigs in a Puff With Choux Pastry,Cocktail weenies necessity proper Super Bowl whether alone hosting exuberant guests Wrapping Smokies blankets pastry traditional move those want bend rules offering bowl
sports,2023-02-03,Lifehacker.com,Expansive Cinematic Universes That Aren t Marvel or Star Wars,idea third Wasp down Bored with fourteenth spin third Star Wars movie here praise rather than bury expansive multi media universes Marvel Star Wars increasing extent even Star
sports,2023-01-16,Business Insider,Taliban officials praise Afghanistan s first sports car It has an engine from a Toyota Corolla,Taliban spokesperson Zabihullah Mujahid shared video Sunday Mada doing donuts snow
sports,2023-01-25,The Guardian,What s red and sounds like An electric Ferrari once you add fake engine noises,famously loud sports going battery powered makers determined that will keep trademark roarName Ferrari Took road Continue reading
sports,2023-02-01,Business Insider,Arena Football League relaunches with first Black commissioner of a professional sports league in the US,Arena Football League relaunching under leadership plans resume play Insider learned
sports,2023-01-23,Boing Boing,The trailer for Undisputed marks the first major boxing game in a decade,Sports video games strange subgenre Outside annual release schedule which virtually ensures only slight increase gameplay between entries central premise sports games pretty ludicrous play digital version game that
sports,2023-02-10,Business Insider,A record number of Americans are betting on the Super Bowl this year,Sports betting companies could real winners Super Bowl Sunday over million people projected wager game
sports,2023-01-17,The Spun,Sports World Is Saddened By The Usain Bolt Update The Spun,Sports World Saddened Usain Bolt Update Spun Usain Bolt missing from account lawyers News Usain Bolt seeks missing from Jamaica investment firm Toronto Usain Bolt
sports,2023-01-16,CBS Sports,Bengals vs Ravens score Sam Hubbard s historic touchdown keeps Cincinnati s AFC title defense alive CBS Sports,Bengals Ravens score Hubbard historic touchdown keeps Cincinnati title defense alive Sports Stunning fumble return Bengals beats Ravens keeps Cincinnati postseason alive Yahoo Sports Instant analysi
sports,2023-02-14,CNN,Super Bowl had million viewers the third most watched TV program ever,Super Bowl delivered super ratings
sports,2023-02-10,The Guardian,Zelenskiy Russia s return to Olympics would be manifestation of violence,Ukraine president spoke summit sports ministers Terror Olympism opposites they cannot combined Russia presence next year Paris Olympics would manifestation violence Ukraine president Volody
sports,2023-02-07,NPR,Tom Brady ends his football playing days but he s not done with the sport,interview with Michael McCarthy Front Office Sports spoke about Brady upcoming broadcast career Brady signed contract with last year their lead analyst
sports,2023-02-04,The Guardian,There s a curiosity about what s behind the curtain the rise and rise of TV sports reality shows,From surfing tennis Formula football hopes lure younger audience with behind scenes seriesThere moment early first episode Netflix behind scenes tennis show Break Point which year Costeen Hatzi curren
sports,2023-01-27,The Guardian,The pickleball revolution how a game for all ages became one of the world s fastest growing sports,gentle cross between tennis badminton ping pong pickleball easy game pick Wollaston little dinkThe sports hall school Malden south west London seem unlikely venue revolution here Thursd
sports,2023-02-03,Business Insider,I drove the new Nissan Z It s a beautiful retro modern sports car with a few pesky flaws,Nissan start beloved sports drove with stunning blue interior exterior
sports,2023-02-15,The Guardian,Tottenham quiet on reports of bn takeover by billionaire Jahm Najafi,Iranian American chair Sports Capital Tottenham insist they receive approach Tottenham have said there been approach from Jahm Najafi after claims that Iranian American ready offer
sports,2023-02-08,Yahoo Entertainment,Some experts don t know anything CeeDee Lamb on the criticism surrounding Dak Prescott,Sports Seriously sits down with CeeDee Lamb Super Bowl LVII Radio
sports,2023-02-06,ESPN,Brady says he ll start with Fox Sports in,Brady said Herd with Colin Cowherd that begin role broadcaster with Sports fall
sports,2023-01-23,Reuters,Juventus share price slides after point penalty Reuters,Shares Juventus href https reuters companies JUVE target blank JUVE tumbled around Monday after Italian soccer authorities href lifestyle sports juventus handed point deduction transfer deals docked
sports,2023-01-31,Reuters,Ukraine on mission to ban Russia from Paris Olympics Reuters,Ukraine hopes secure widespread international support banning Russian Belarusian athletes from Paris Olympics Moscow href world europe biden says ukraine russia claims gains invasion sports minister
sports,2023-02-02,Reuters,Ferrari sees even stronger after beating forecasts in Q Reuters,Luxury sports carmaker Ferrari href https reuters companies RACE target blank RACE said Thursday core earnings rose fourth quarter last year said outstanding full year results provided base
sports,2023-01-18,Reuters,Explainer Jim Ratcliffe who is the INEOS founder bidding for Reuters,INEOS company owned Ratcliffe British billionaire long time Manchester United formally entered href lifestyle sports ineos enters bidding process manchester united times bidding process Prem
sports,2023-02-01,Reuters,Ukraine s Elina Svitolina calls for ban on Russians and Belarusians Reuters,Ukrainian tennis player Elina Svitolina called Wednesday Russian Belarusian athletes banned from Olympic Games Paris Moscow invasion country hours after href lifestyle sports latvia would send athletes
sports,2023-01-30,Reuters,Acting WRU chief Walker apologises for handling of sexism Reuters,Acting Welsh Rugby Union chief executive Nigel Walker apologised governing body handling allegations sexism misogyny after predecessor Steve Phillips href lifestyle sports welsh rugby union chief phillips resigns walker
sports,2023-01-18,Reuters,Who could buy Manchester United and how much is it worth Reuters,Ratcliffe company INEOS formally entered bidding process Manchester United Tuesday months after club owners Glazer family said they were considering selling club they explore href lifestyle sports manchester united
sports,2023-01-27,Reuters,Germany s IONOS eyes market value of up to bln euros in IPO Reuters com,German hosting firm IONOS targets market capitalization billion euros billion initial public offering first major European since sports maker Porsche href https reuters companies target
sports,2023-02-01,Reuters,Premier League is financially doped says LaLiga president Reuters,Spain LaLiga president Javier Tebas said teams Premier League financially doped after they href lifestyle sports premier league clubs spend first time january transfer window spent record billion Janu
sports,2023-02-15,NPR,One of boys rescued from the Thai cave dies at a British school,captian boys soccer team rescued from flooded cave Thailand found unconscious room sports academy attending England
sports,2023-01-23,Wired,TCL Series Model R Review The Best Value TV Right Now,Thanks large part pedestal mount automatic adjustments this tier once again
sports,2023-02-10,Business Insider,Super Bowl LVII kicks off on February with the Chiefs facing the Eagles here s how to livestream the big game,Sports will broadcast Super Bowl LVII February Chiefs Eagles compete Lombardi Trophy
sports,2023-01-17,DallasCowboys.com,Game Recap Dak Defense Dominate in Win DallasCowboys com,Game Recap Defense Dominate DallasCowboys masterclass Prescott poised execution from pocket with ESPN Brett Maher finally makes extra point Cowboys lead Sports
sports,2023-01-16,AL.com,Miami coach responds to reports on Tua Tagovailoa s future AL com,Miami coach responds reports Tagovailoa future Dolphins Tagovailoa actions will speak much more loudly than words Sports Tagovailoa remain starting Dolphins expect read
sports,2023-01-17,NFL News,NFL Power Rankings Divisional Round Chiefs AFC rivals tested Giants rise to occasion Chargers flop NFL com,Power Rankings Divisional Round Chiefs rivals tested Giants rise occasion Chargers flop playoffs bracket Divisional round odds schedule preview Cowboys renew playoff rivalry Sports
sports,2023-01-21,Yahoo Entertainment,Tony Dungy Comments About Damar Hamlin At March For Life,Sports Tony Dungy spoke anti abortion march Washington Friday
sports,2023-02-15,ESPN,From Baroque to the big game The fine art of the NFL playoffs,meme maker Make Sports been combining finest photos from sports since With appearances from Napoleon Bartholomew others account offered museum quality tour postseason
sports,2023-01-17,Hackaday,The First Afghan Sports Car Has An Engine You Shouldn t Mock,news today Afghanistan made first sports sleek slung model with throaty exhaust note that would second look Autobahn just much
sports,2023-01-22,The Guardian,Leeds v Brentford Premier League live,Premier League updates from kick touch with Alex email Twitter Some match reading Louise Taylor Leeds abundance attacking options their manager arrival LinkedIn Marsch tells
sports,2023-02-08,The Guardian,Elena Fanchini Italian skier and world silver medalist dies aged from tumor,Italian skier Elena Fanchini dies from tumor Fanchini silver world championships Italian skier Elena Fanchini whose career short tumor died Fanchini passed away Wednesday home
sports,2023-02-01,The Guardian,The Spin Whose data is it anyway Behind the fight to control cricketers statistics,Cricket heavy with statistics battle over fair usage control them just beginningCricket lovers their nature probably more inclined than most appreciate things that happen gentle pace sporting encounters perhaps also
sports,2023-01-27,The Guardian,Donald Trelford obituary,Editor Observer fought retain paper integrity identityDonald Trelford died from cancer aged edited Observer world oldest Sunday newspaper years from while fighting much
sports,2023-01-19,ABC News,Court challenge to Indiana trans sports ban has been dropped,lawsuit challenging Indiana prohibiting transgender students from competing girls school sports been dropped just weeks before heard federal appeals court
sports,2023-02-01,Engadget,How to stream every game with Apple s MLS Season Pass,Apple dabbled live sports with weekly Major League Baseball games last year company launching most ambitious offering Today company debuts Season Pass subscription that gives soccer fans access every game
sports,2023-01-19,The Guardian,Head of Indian wrestling federation accused of sexual harassment,Wrestlers including Olympic medallists stage demanding federation disbandedTwo Olympic medal winning wrestlers India have accused head their sport governing body coaches sexually harassing female players have vowed prot
sports,2023-01-26,Reuters,OCA offers Russian Belarusian athletes opportunity to compete at Reuters,Olympic Council Asia said Thursday offered Russian Belarusian athletes take part Asian Games first step towards them competing Paris summer Olympics
sports,2023-01-18,Reuters,Argentine corn field planted with face of World Cup winner Messi Reuters,Lionel Messi been immortalized Argentina tributes ranging from href lifestyle sports argentine tattooists swamped demand messi tributes tattoos href https reuters video watch buenos aires mural celebrates
sports,2023-02-05,CNN,Pro Bowl Games How to watch and what to expect,traditional Bowl been revamped season rebranded Bowl Games breathe life into longstanding praxis bringing together league talent
sports,2023-01-24,CNN,Rupert Murdoch abandons plan to recombine Fox and News Corp,Rupert Murdoch abandoned plans combine Corporation News Corporation move that would have reunited broadcasting print publishing companies under roof
sports,2023-02-16,Engadget,Microsoft explains Bing s bizarre AI chat behavior,Microsoft launched Bing chat product Edge browser last week been news ever since always right reasons initial impressions were strong offered workout routines travel itineraries more withou
sports,2023-02-16,Engadget,The Morning After Elon Musk reportedly had his own tweets boosted out of jealousy,been using Twitter feed this week might noticed algorithmic feed showed Elon Musk tweets replies According Platformer which interviewed Twitter employees engineers tweaked social network benefit thei
sports,2023-02-03,Time,Meet the Real Women Whose Year Friendship Inspired For Brady,real life group five longtime friends made Over Brady club that inspired sports comedy film
sports,2023-02-15,Digital Trends,JBL Endurance Peak review pure sports,earbuds that will hold onto your ears never Endurance Peak outgrip outlast almost activity throw them
sports,2023-02-14,Yahoo Entertainment,Court to reconsider Connecticut s transgender athlete policy,federal appeals court reinstated challenge Connecticut policy allowing transgender girls compete girls high school sports months
sports,2023-01-16,The Guardian,UK Sport and Sport England lay out proposals after Whyte Review,Funding bodies make wide ranging commitments Review exposed shocking culture gymnastics multimillion pound investment integrity British sport been launched after British Gymnastics abuse scandal propo
sports,2023-01-17,The Guardian,F facing four week hole in schedule with no replacement for Chinese GP,Alternatives including race Algarve turned down Covid policy means China misses fourth year Formula will have four week hole this season calendar after sport confirmed Chinese Grand Prix would repl
sports,2023-02-01,The Guardian,IOC stands by sanctions against Russia and Belarus over invasion of Ukraine,Sanctions against countries negotiable says Ukraine hopes secure widespread support bans week after seeming open door Russia Belarus compete Olympics International Olympic
sports,2023-01-19,Polygon,EA s golf game returns with more courses more customization and more shots,Sports Tour launches March Xbox Series Masters Augusta National four major championships included
sports,2023-02-08,CNET,The Documentary Series on Netflix Everyone Needs to Watch CNET,Every episode amazingly well together
sports,2023-01-31,Reuters,EV maker Lotus Tech plans U S IPO via deal with SPAC L Catterton Reuters,Lotus Technology will public United States merger with special purpose acquisition company Catterton Asia Acquisition Corp href https reuters companies LCAA target blank LCAA deal that will value combined
sports,2023-02-16,Time,NCAA Asks Federal Appeals Court to Block Slippery Slope of Student Athlete Pay,Critics play scheme fear cost could lead schools sports that generate much revenue
sports,2023-01-16,Reuters,Australian Open draw schedule seeds and how to watch on TV Reuters com,Australian Open hardcourt Grand Slam first four major tournaments year Managed Tennis Australia event first held Here what need know
sports,2023-01-25,Reuters,Slalom queen Shiffrin not immune to sport s uphill battle for brands Reuters,American Mikaela Shiffrin Alpine skiing history will inspire young fans brands harder sway sport fights bigger share sponsorship experts
sports,2023-02-01,Reuters,Brady s broadcasting future presents new challenge for the ultimate Reuters,Brady ultimate winner field that success does guarantee seven time Super Bowl champion will make seamless transition when steps into booth begin role lead analyst
sports,2023-02-12,The Guardian,Sky Brown becomes Britain s first skateboarding world champion aged,Brown wins gold park skateboarding Sharjah trying enjoy much could says Olympic bronze medallist Brown become Britain first skateboarding world champion gold park
sports business,2023-02-01,Reuters,Premier League clubs spend bln for first time in January transfer Reuters,Premier League soccer clubs spent record million pounds billion January transfer window analysis from Deloitte Sports Business Group said Wednesday
sports business,2023-02-08,CNN,How Bed Bath Beyond ended up on the verge of bankruptcy,Bath Beyond America quintessential home furnishings chain fighting stay business
sports business,2023-01-27,Entrepreneur,WSC Sports Was Built on a Love for Sports It Changed The Entire Game,Sports revolutionized sports highlights created distributed consumed
sports business,2023-02-01,CNN,Coca Cola s Powerade is taking a jab at Gatorade with new formula and packaging,Gatorade long been leader among sports drinks those brightly colored beverages designed replenish electrolytes lost when sweat rival Powerade hoping that revamped recipe look will help finally unseat Gatorade from
sports business,2023-01-30,The Guardian,JD Sports hit by cyber attack that leaked m customers data,Retail group says incident affected shoppers Size Millets Blacks Scotts Millets Sport brandsThe fashion retailer Sports said personal financial information million customers potentially accessed hackers cyber attack
sports business,2023-01-18,The Guardian,UK sports facilities face closure without government help warn leading bodies,Government urged change decision energy discount This will impact millions people ages backgrounds government must reverse decision exclude swimming pools from energy discount scheme face natio
sports business,2023-01-18,Reuters,Former Fox execs conspired to bribe FIFA officials prosecution Reuters,Argentine businessman testified Wednesday that former Century executives sports marketing company conspired with bribe South American soccer officials secure lucrative broadcasting rights
sports business,2023-02-01,Business Insider,Arena Football League relaunches with first Black commissioner of a professional sports league in the US,Arena Football League relaunching under leadership plans resume play Insider learned
sports business,2023-02-14,Gizmodo.com,Google Launches Way for Android Apps to Track You Without Tracking You,Google unveiled beta version Privacy Sandbox Android Tuesday part years long effort transform business internet make harder companies feast buffet that your personal data Paradoxically Google says
sports business,2023-01-17,Android Central,Samsung teases the Galaxy S Ultra s powerful performance pro grade camera,head Samsung Business teasing what expect upcoming Galaxy Unpacked event including Galaxy Ultra
