LABEL,Date,Source,Title,Headline
politics,2023-02-16,The Guardian,What did Nicola Sturgeon change in Scotland for women in politics Everything Dani Garavelli,record wasn perfect transformed landscape exit speech made rueful what might have beenPulling into service station listen Nicola Sturgeon resignation speech Wednesday morning wave sadness wasn
politics,2023-01-26,The Guardian,Outrage greets Meta decision to lift Trump Facebook ban US politics live,president allowed back platform after years away Sign receive First Thing daily briefing email Good morning politics blog readers coming into lively news with colorful reactions Meta move
politics,2023-01-27,Reuters,Myanmar army set to cement rule with tough new election rules Reuters com,Myanmar ruling junta Friday announced tough requirements parties contest election this year including huge increase their membership move that could sideline military opponents cement grip politics
politics,2023-01-19,Reuters,A sign of the times NZ PM Ardern s resignation resonates for women Reuters com,Thursday shock resignation Zealand Prime Minister Jacinda Ardern altered face global politics when elected world youngest female head state throws spotlight punishing demands faced women power
politics,2023-02-01,Reuters,U S African American studies does not include material targeted by Reuters,African American studies course high school students that released Wednesday does include material that Florida conservative governor said pushed liberal agenda latest development fierce debate about politics education
politics,2023-02-14,NPR,Where Greta Thunberg does and doesn t expect to see action on climate change,Greta Thunberg says plans into politics career thinks more climate campaigner outside
politics,2023-02-13,The Guardian,Cowering to politics how AP African American studies became the most controversial course in the US,After Florida governor vowed block class revised version with writings removed sparked swift backlashKeziah Ridgeway says teaching African American history about being teacher that never Philadelphia public high school
politics,2023-02-09,The Guardian,Dining across the divide If we had been on a train we wouldn t have spoken but we had so much in common,They bonded over little everyday things where they stand immigration imperialism Russell LondonOccupation University lecturer British European politics Continue reading
politics,2023-02-15,NPR,How the politics of race will play a key role in Nikki Haley s campaign,Haley woman color South Carolina taking down Confederate flag from state capitol That makes campaigning complex party Trump
politics,2023-02-07,Boing Boing,The Arab World in the s is a two part documentary on politics culture economics and society,What happened Arab world What Arab world Where Arab world have politics Arab world impact regional global politics What history occupation Palestine conflict with
politics,2023-01-18,BBC News,Ukraine war Who was Interior Minister Denys Monastyrsky,most senior Ukrainian official since began been long government
politics,2023-01-19,The Guardian,Sunak aims at straight talking on the soapbox to woo voters,Whistle stop tour northern England regions mirrors past Tory efforts politics politics live latest news updatesRishi Sunak flew north England Thursday seat show voters there that understood
politics,2023-02-06,NPR,Gen Z s political power new data gives insight into America s youngest voters,Generation which turned large numbers along with millennials last election still politics report exclusively obtained adds more context youngest voting block
politics,2023-01-17,Entrepreneur,Things Gen Z Employees Want Their Managers to Know About the Workplace in,workplace environment constantly evolving changing younger employees like those traditional office politics something they care about Here capture their attention instead
politics,2023-01-27,The Guardian,Why is British politics a raging bin fire Don t ask the misunderstood heroes who held the torches Marina Hyde,From Truss Johnson former chaos mongers sure none remotely their fault fact time ripe comebackIt encouraging Truss hoving back into view after period wilderness only slightly longer than that endured
politics,2023-01-19,The Guardian,Labour claims levelling up fund in chaos because of payment delays and allegations of favouritism UK politics live,Latest updates prime minister make series visits across north east promote levelling funding Good morning Rishi Sunak today announced spending splurge more than community projects second round awards from
politics,2023-01-29,Business Insider,German chancellor s indecision on sending tanks to Ukraine has created a new word in Western war room politics Scholzing,Olaf Scholz Germany chancellor inspired term which means indecisive foot dragging despite communication good intentions
politics,2023-01-25,Reuters,Fed s Brainard frontrunner for White House top economist post Reuters,Federal Reserve Vice Chair Lael Brainard leading contender economic advisory position White House Washington Post href https washingtonpost politics lael brainard national economic council target
politics,2023-01-19,Reuters,New Zealand s Ardern leaves legacy of kindness disappointments Reuters,Jacinda Ardern tiny Zealand five years prime minister becoming global icon left leaning politics women leadership even struggled home with economy COVID restrictions
politics,2023-02-02,BBC News,Why lifting Tanzania s opposition ban suits President Samia,democracy faring President Samia dismantles some predecessor dictatorial policies
politics,2023-02-15,The Guardian,Millions of us marched over Iraq and were ignored Now we have broken politics and endless war Lindsey German,changed public opinion couldn stop consequences have been terrible Iraqis usNo they weren warned Mass opposition wars tends emerge only after they have been waged some time protests again
politics,2023-02-14,Seths.blog,Fidelity compression and culture,alphabet miracle that compounded books lessons learn from this cornerstone modern culture apply organizations meetings tech politics almost everything together Your copy Kill Mockingbird contains
politics,2023-01-19,The Guardian,Dining across the divide He s not visibly queer like me and I don t think he faces the same issues,votes Labour other called Thatcher they agree disagree politics Will they such amicable ground when comes gender David BurnleyOccupation Works teaching training research Continue reading
politics,2023-01-27,Business Insider,Pelosi attack suspect says he was motivated by politics telling police that Democrats had been persecuting Trump,jailhouse interview David DePape echoed former President Donald Trump falsely claiming Democrats stolen election
politics,2023-02-15,Boing Boing,Nikki Haley explains how she will oust Donald Trump and Mitch McConnell from politics video,Nikki Haley wasn kidding when said presidential video announcement time generation leadership Today Republican ageist warned year Donald Trump year Mitch McConnell that their time
politics,2023-01-16,INSIDER,Viktor Bout the convicted arms dealer the US swapped with Russia for Brittney Griner was nicknamed The Merchant of Death and inspired a Nic Cage movie,Viktor Bout Biden admin traded prisoner swap Brittney Griner jumped into right politics upon getting home Russia
politics,2023-02-14,Wired,Keanu Reeves Will Never Surrender to the Machines,Matrix movies brought Reeves Chad Stahelski together killing their fourth John Wick still keeping technology check
politics,2023-01-24,The Guardian,Humans able to understand other apes better than thought research suggests,Study from Andrew University gauges ability people interpret bonobo chimpanzee gesturesWe able strike conversation debate politics chat about meaning life with other great apes ability understand
politics,2023-01-22,The Guardian,LBJ OK Historian Mark Lawrence on a president resurgent,Fifty years after Lyndon Johnson died director president library discusses politics progressive idealsFifty years Sunday Lyndon Baines Johnson died been power since stepping down president
politics,2023-02-07,The Guardian,Ministers accused of being on strike as action by nurses in England continues,Sunak urged come table negotiate biggest walkout history shows sign ending politics live latest news updates Nurses continue industrial action Tuesday government accused being
politics,2023-02-01,The Guardian,Boris Johnson anyone who thinks I covered up parties is out of their mind,Former tells Nadine Dorries talkshow idea knowingly going rule breaking parties birds politics live latest news updates Boris Johnson said anyone suspects deliberately covered lockdown parties
politics,2023-02-03,The Guardian,Ten great video games about evil corporations,Take break from news about real life megacorps raking billions while struggle bills revisit gaming most evil companiesSquaresoft environmentalist fable pitches small group rebels against might Shinra Electric
politics,2023-01-19,The Guardian,You re not idiots Sunak says people understand why he can t cut taxes now video,Explaining government able taxes prime minister said public were idiots Speaking question answer session Lancashire levelling agenda Sunak said Conservative want your taxes
politics,2023-01-20,The Guardian,Home Office vows to act over invasive personal record requests in rape cases,Official findings show current system causing delays investigations access justice victims politics live latest news updates Rape victims having significant amounts their personal records unnecessarily requested
politics,2023-01-30,The Guardian,Nadhim Zahawi sacking the questions still facing Rishi Sunak,Zahawi sacking came blue sources Tory what prime minister knew whenAlthough Nadhim Zahawi been sacked Rishi Sunak vowed restore integrity politics prime minister still faces scrutiny over
politics,2023-02-01,The Guardian,Ministers and unions dig in amid widespread strike action across UK,Little prospect breakthrough strikes schools trains universities border checks across country politics live latest news updates Unions government appeared apart ever after Wednesday widespread strike
politics,2023-02-03,The Guardian,Bollywood is obsessed with Pakistan We d be flattered if it weren t so nasty,industry might Modi quasi fascist politics cannot jaunty music helicopter stuntsIf recent Bollywood films indication fair that India film industry obsessed with Pakistan Obsessed Like standing outside
politics,2023-01-26,The Guardian,I m a boy in my teens and I m worried about my oldest friend We ve hit a divide over politics Leading questions,Beliefs respond live what feel writes advice columnist Eleanor Gordon Smith give your friend experiences that could help change hisI late middle teens worried about oldest friend also cousin
politics,2023-01-19,The Guardian,Poverty is a big killer in the UK Where is the political will to defeat it Letters,cost living crisis should Westminster footing inspire political consensus says life peer founder Issue John BirdI born years into abject poverty slums Notting Hill Time passed
politics,2023-02-13,The Guardian,From Joe Biden to Madonna ageism is everywhere Margaret Sullivan,getting older youth obsessed culture those would mock their elders words advice just waitJust before President Biden turned November said something that could identify with that didn even want
politics,2023-02-15,The Guardian,Nicola Sturgeon resigns as first minister of Scotland video,Nicola Sturgeon standing down first minister Scotland announced press conference shock decision Scotland longest serving first minister said instructed Scottish National party begin process electing
politics,2023-01-23,Slate Magazine,On This Non Anniversary of Roe the Politics of Power Amidst Uncertainty Are Clear,just repeal abortion rights that make order clear everything else that come with
politics,2023-02-09,Business Insider,NH GOP Gov Chris Sununu says Republicans were rude during Biden s State of the Union address My mother taught me manners first,Sununu also said Arkansas Sarah Huckabee Sanders rebuttal helpful when described Republicans normal Democrats crazy
politics,2023-02-09,Boing Boing,It is unclear how JK Rowling s outspoken anti trans politics will affect video game sales,People playing Hogwart Legacy been very popular Twitch long running debate about appreciating while knowing artist dirtbag continues know that nothing Harry Potter will ever purchased household again Read
politics,2023-02-15,The Guardian,First Ardern now Sturgeon leaders echo dehumanising pressures,Like Zealand Scotland first minister speaks duty admit brutality political life herShe stressed human being just politician wrestled with accepting simply longer reserve
politics,2023-01-23,Boing Boing,The Caliph and the Imam looks to be a fascinating historical read about the Sunni Shii split in Islam,Origin stories roots roots split grow Constructing narrative about origin stories that concern splits disagreements consequences root divisions intention this book about genealogies origins Islam
politics,2023-02-16,The Guardian,The Guardian view on Nicola Sturgeon a warning at the end of the road,Scotland first minister been dominant political figure resignation does mean that independence deadNicola Sturgeon resignation massive political event shall return that also something more this mass
politics,2023-02-01,Boing Boing,New pillow for middle aged Italian men who just moved out of their parent s house,Pillows politics words that lead many directions Whether scandals between sheets with textiles designs functionalities materials comfort health pillows expanding their range utility this video
politics,2023-02-09,Boing Boing,Rep Jamie Raskin perfectly mocks Speaker Kevin McCarthy with facts about the Republican s high crime district video,Republicans have long blamed crime Democrat cities Kevin McCarthy Congress trying intervene Washington local politics with bill that would dictate penalties crime fiery remarks made floor yesterday
politics,2023-01-17,BBC News,Vietnam politics Power shift as President Nguyen Xuan Phuc quits,move comes amid anti corruption drive signals power shift among communist leaders
politics,2023-02-06,Liberalpatriot.com,Politics became a matter of faith for many contemporary progressives,politics became matter faith many contemporary progressives
politics,2023-02-04,The Guardian,Conservatives angry about school indoctrination are telling on themselves Jan Werner M ller,Ideologues like DeSantis aren angry politics education they angry their politics have monopolyThe rightwing governor Florida DeSantis administration recently blocked proposed black studies course advanced placeme
politics,2023-02-08,The Guardian,Biden delivers strong State of the Union speech to boost chances of re run live,President condemns Republicans over proposed cuts Sign receive First Thing daily briefing email Good morning politics readers coming back Biden State Union address last night where
politics,2023-02-01,The Guardian,The Guardian view on economics in the media poorly communicated poorly understood Editorial,Economics affects often treated abstract field fenced impenetrable rulesThe statistical football this week lobbed from Washington From headquarters International Monetary Fund predicted
politics,2023-01-25,Gizmodo.com,Elon Quickly Finds Out Nick Fuentes Is Just Too Much of a Nazi for Twitter,After just after being reinstated back Twitter thanks owner Elon Musk blanket pardon hate figures white nationalist anti Semite Nick Fuentes once again been kicked platform Read more
politics,2023-01-25,BBC News,Jacinda Ardern s successor Chris Hipkins sworn in as New Zealand PM,Hipkins built reputation minister Zealand Covid strategy
politics,2023-02-04,The Atlantic,The French Are in a Panic Over le Wokisme,nation vehement rejection identity politics made recalibrate views about woke ideology
politics,2023-01-16,The Guardian,Iran will be held to account over execution of Alireza Akbari says James Cleverly video,foreign secretary said that Iran will held account over execution British Iranian national Alireza Akbari Speaking Commons Cleverly said message that regime clear world watching will held
politics,2023-01-17,The Guardian,Minister says UK government respects devolution despite blocking Scottish gender bill video,Scottish secretary told would issue section order stop gender recognition reform Scotland bill from getting royal assent Alister Jack acknowledged significant decision from Westminster section Scotland
politics,2023-01-21,The Guardian,Jacinda Ardern proved a true leader knows when to step back If only US politicians could do the same Arwa Mahdawi,There real problem when same people cling power decades refuse make room bloodIt inevitable that someone going that most cliched questions voil they Shortly after Jacinda Ardern shock resignation
politics,2023-01-18,The Guardian,PMQs Starmer and Sunak clash over ambulance waiting times video,Keir Starmer called Rishi Sunak apologise leaving lethal chaos under watch During weekly prime minister questions House Commons Labour leader cited figures ambulance waiting times across country
politics,2023-01-26,The Guardian,Windrush inquiry head disappointed as Braverman drops crucial measures,Wendy Williams remarks come after home secretary confirms three commitments will implemented politics live latest news updates head inquiry into Windrush debacle expressed disappointment after Suella
politics,2023-01-18,The Guardian,Fiji s government may have changed but the military is making it clear it will not disappear quietly Jon Fraenkel,commander Fiji military forces signalling that government must tread carefully reforms particularly those that might lessen military powerWe starting what Fiji politics likely look like under government
politics,2023-01-20,The Guardian,Nicola Sturgeon says Scotland secretary is acting like a governor general,First minister says Alister Jack block gender marks more dangerous phase devolution politics live latest news updates Nicola Sturgeon accused Scotland secretary acting like governor general furth
politics,2023-01-24,The Guardian,Rishi Sunak refuses to state Nadhim Zahawi has been honest about taxes,decision order inquiry fails limit fallout from Tory chair opaque dealings with HMRC politics live latest news updates Rishi Sunak political distancing from Nadhim Zahawi taken another step with Downing Street
politics,2023-01-26,The Guardian,Hunt to promote low tax and private sector re tooling of industry,Chancellor also expected tell markets that government spending will remain within strict limits politics live latest news updates Jeremy Hunt will defend government vision Britain economic future speech City execut
politics,2023-01-18,The Guardian,Liz Truss Jenga style podium cost taxpayers,Lectern featuring blocks wood made former lasted days resembled popular game politics live latest news updates Jenga style podium used Truss short lived stint prime minister cost taxpayers
politics,2023-01-18,The Guardian,Sunak on shaky ground over concessions to rebels say senior Tories,Former ministers risks counter rebellion over planning environment online safety amendments politics live latest news updates Senior Tories have privately voiced fears about slew concessions made Rishi Sunak rebels
politics,2023-01-30,The Guardian,Last minute talks to start in bid to avert teachers strike in England and Wales,Union leaders meet education secretary before planned action Wednesday dispute over politics live latest news updates Union leaders hold last minute talks with government avert strike action teachers
politics,2023-02-07,The Guardian,Boris Johnson agreed Brexit protocol knowing it was mess says John Major,Johnson administration made promises over Northern Ireland deal that knew were unworkable former tells politics live latest news updates John Major launched scathing attack Boris Johnson handling Brexit saying
politics,2023-01-17,The Atlantic,Conspiratorial Thinking Is an American Disease,past decade conspiratorial thinking shifted from worrying factor Republican politics defining feature
politics,2023-01-27,Screen-idle.com,Classified Death Star documents discovered in Darth Vader s garage,classified document scandal that recently engulfed politics appears have spread Galactic Empire
politics,2023-02-14,The Guardian,Deal on Northern Ireland protocol could be struck next week sources say,Negotiations crucial final phase with Rishi Sunak preparing hold calls with leaders politics live latest news updates Negotiations over Northern Ireland protocol crucial final phase with potential deal
politics,2023-02-11,The Guardian,Bruce Dern If you want to succeed in any craft you have to be patient,actor resilience honing skills impossibility retirement losing child going running every dayOurs family that shit done grandfather America Secretary previously governor Utah part
politics,2023-01-28,Reuters,Zelenskiy adviser IOC promotes Russian anti human policy Reuters,senior Ukrainian presidential aide slammed International Olympic Committee Saturday siding with Russia days after said Olympic Council Asia offered Russian Belarusian athletes chance qualify Paris Olympics
politics,2023-02-16,The Guardian,Right Dishonourable Friend review nepo baby MP lands in Lancashire in heartfelt comedy,Vaults LondonPhoebe Batteson Brown archly comic clueless Perdita subplot about queer teenager hypocrisy politics that real depth itThis surprisingly heartfelt political comedy really much deeper play
politics,2023-02-05,BBC News,Turkey elections Biggest test for Erdogan amid cost of living crisis,Rampant inflation issue voters Turkey President Erdogan faces elections
politics,2023-01-17,The Guardian,Blocking Scotland s gender bill is no anti woke crusade But it s not a democratic outrage either Martin Kettle,Some suspect Rishi Sunak trying start culture there real legislative problem hereMany will Rishi Sunak decision stop Scotland gender recognition bill from becoming both bigoted brutal Bigoted because
business,2023-01-26,Wired,The Workforce Is Failing Women Business Leaders Can Stop It,Workplaces must undergo huge structural changes they stop exodus
business,2023-02-08,CNN,How Bed Bath Beyond ended up on the verge of bankruptcy,Bath Beyond America quintessential home furnishings chain fighting stay business
business,2023-01-19,BBC News,When dogs in Alaska wait for the bus,love dogs exploded into business that delighted internet once
business,2023-01-31,BBC News,Trump repeatedly refuses to answer in four hour interview,president deposed part state investigation into family business practices
business,2023-02-02,BBC News,How the empire of one of the world s richest men lost bn,business tycoon seen billions wiped wealth after investment firm scathing report
business,2023-02-13,BBC News,Double Dutch The twins shaking up the drinks industry,Joyce Raissa Haas founded Double Dutch drinks explain power twins business
business,2023-01-20,CNN,From the Emirates to Davos South Korea s big week in global business,South Korea leader capping whirlwind week after securing tens billions dollars investment from Middle East vowing have country play more important role revitalizing international supply chains
business,2023-01-24,Business Insider,Revenued Business Card review,Revenued Business Card large bonus earns back purchases with credit check doesn even charge there catch
business,2023-02-13,The Guardian,UK business output hammered by rising costs and consumer gloom business live,Rolling coverage latest economic financial news mobile broadband firms plan huge price rise existing customers There surge companies collapsing last year figures show bankruptcies
business,2023-02-09,The Economist,Business,world this week
business,2023-01-19,The Economist,Business,world this week
business,2023-02-02,The Economist,Business,world this week
business,2023-01-26,The Economist,Business,WEEKLY EDITION
business,2023-02-16,The Economist,Business,world this week
business,2023-01-20,CNN,Global interest rate hikes are yet to bite says IMF head,world economy still sticky spot according head International Monetary Fund despite cautious optimism among economists business leaders that slowing inflation means worst last year crises over
business,2023-02-15,CNN,Brand new Boeing scrapped after flights,world largest business Boeing configured private plane Saudi royal being scrapped after having spent just hours service over flights
business,2023-01-28,Due.com,Is Buying an Aged Corporation a Good Idea,Getting business running difficult Especially when your business needs meet business credit requirements apply business loans government contracts Getting
business,2023-01-18,Reuters,U S business inventories rise in November as sales fall Reuters,business inventories increased November higher interest rates depressed sales boosting inventory sales ratio highest level nearly years
business,2023-01-16,Reuters,New Zealand business confidence at lowest since Reuters com,Zealand business confidence fourth quarter last year lowest level since companies grapple with higher interest rates cost pressures soft demand private think tank said Tuesday
business,2023-01-26,Reuters,Unfinished business in F Never say never says Vandoorne Reuters,Doors hard open easily closed Formula Formula champion former McLaren driver Stoffel Vandoorne ruling nothing even grand prix comeback looks unlikely electric racing main focus
business,2023-01-30,Reuters,France says French Emirati business council will advance economic Reuters,France United Arab Emirates working strengthen their economic relationship with concrete outcomes expected near future French finance minister Bruno Maire said Monday during visit Gulf Arab state
