LABEL,Date,Source,Title,Headline
sports betting,2023-01-27,Reuters,Alfa Romeo F team announce co title partnership with Stake Reuters com,Alfa Romeo Formula team announced multi year title partnership with online casino sports betting platform Stake Friday previous Polish sponsor Orlen switched rivals AlphaTauri
sports betting,2023-02-10,Business Insider,A record number of Americans are betting on the Super Bowl this year,Sports betting companies could real winners Super Bowl Sunday over million people projected wager game
sports betting,2023-01-27,Entrepreneur,WSC Sports Was Built on a Love for Sports It Changed The Entire Game,Sports revolutionized sports highlights created distributed consumed
sports betting,2023-01-17,NFL News,NFL Power Rankings Divisional Round Chiefs AFC rivals tested Giants rise to occasion Chargers flop NFL com,Power Rankings Divisional Round Chiefs rivals tested Giants rise occasion Chargers flop playoffs bracket Divisional round odds schedule preview Cowboys renew playoff rivalry Sports
sports betting,2023-01-30,The Guardian,Talking Horses Racing awaits impact of white paper on gambling reform,Some form affordability checks likely reports suggest some gambling firms have decided jump gunFor centuries sailors dreaded Doldrums equatorial waters where ship could becalmed weeks while crew were slowly driven
sports betting,2023-02-07,ESPN,Survey M adults to bet B on Super Bowl,Survey results from American Gaming Association show that record million adults will combine billion Super Bowl LVII
sports betting,2023-02-01,BBC News,Uganda murder charges after fight between Arsenal and Manchester City fans,people have been killed separate incidents involving Arsenal fans arguing with their rivals
sports betting,2023-02-01,Business Insider,Arena Football League relaunches with first Black commissioner of a professional sports league in the US,Arena Football League relaunching under leadership plans resume play Insider learned
sports betting,2023-01-18,Reuters,Weil adds two more London partners with Freshfields White Case Reuters,firm Weil Gotshal Manges said Wednesday that recruited high yield bond specialists Andy Hagan Gilles Teerlinck partners banking practice London office
sports betting,2023-01-17,ESPN,UFC flyweight Molina a suspect in betting probe,flyweight Jeff Molina suspected having substantial involvement betting scandal currently being probed multiple government entities
sports betting,2023-01-23,The Guardian,Talking Horses Online punters should beware the devil in the detail,level protection your money lack often hidden when signing accountsSome punters will have been crossing days this year Cheltenham Festival March since Saturday morning after last
sports betting,2023-02-10,MarketWatch,MemeMoney As Super Bowl nears Stocktwits CEO highlights huge overlap between sports betting and meme stocks,Americans likely spend some billion betting Sunday game between Kansas City Chiefs Philadelphia Eagles
sports betting,2023-02-01,The Guardian,The Spin Whose data is it anyway Behind the fight to control cricketers statistics,Cricket heavy with statistics battle over fair usage control them just beginningCricket lovers their nature probably more inclined than most appreciate things that happen gentle pace sporting encounters perhaps also
sports betting,2023-01-26,The Guardian,As a footballer I am surrounded by gambling ads This needs to stop David Wheeler,would rather paid less meant profiting from addiction harm suicide only oneI been professional footballer more than decade nearly appearances online casino advert either
sports betting,2023-01-24,The Guardian,PCA joins Slade s Project Red Card battle for players data,Correct time cricket resolve this issue help athletes control data collected about them Professional Cricketers Association joined Project Card battle sportspeople take more control thei
sports betting,2023-02-06,MarketWatch,The Margin How to bet on the Super Bowl legally Everything you need to know about wagering on the big game,Super Bowl expected reach record billion total legal bets Here look some odds where legal game
sports betting,2023-02-06,Insiderintelligence.com,Sightline Payments taps Visa to power prepaid casino cards,Sightline Payments will work with Visa power Play cards which help digitize cash heavy casino gaming sector
sports betting,2023-02-12,ESPN,Everything you need to know to bet Super Bowl LVII,Explore everything need know Super Bowl between Eagles Chiefs including props feature articles picks game
sports betting,2023-01-29,Covers.com,Bengals vs Chiefs Touchdown Props for the AFC Championship Best Touchdown Scorer Bets Covers,Bengals Chiefs Touchdown Props Championship Best Touchdown Scorer Bets Covers Chiefs beat Bengals with last second field goal earn Super Bowl berth Chiefs exact revenge Bengals move face Eagles
sports betting,2023-02-01,Digital Trends,How to legally bet on the Super Bowl online,Super Bowl Kansas City Chiefs will take Philadelphia Eagles Find legally game online
sports betting,2023-01-16,The Guardian,Talking Horses US riches may prove far too tempting for British jockeys,Young rider says racing withering away after earning more winner than month previous year hereRacing governance structure which unveiled November address sport issues over prize money field sizes
sports betting,2023-02-06,The Guardian,Talking Horses High profile owner bemoans cash fall for restaged races,Paisley Park owner Andrew Gemmell raises issue which will solved before transparency over media rights deals money mega stables jump racing plucky band smaller owners manage grab slice cake
sports betting,2023-01-31,CNET,Super Bowl Ads So Far See Spots Starring Dave Grohl Meghan Trainor Anna Faris CNET,Kansas City Chiefs will battle Philadelphia Eagles some planned commercials already
sports betting,2023-01-23,Motley Fool,Investing in Sports Betting Stocks,more states legalize sports betting market growing quickly only states easing restrictions betting growing more popular each year states that have already legalized want invest this quickly growing industry
sports betting,2023-02-15,Bloomberg,Super Bowl s Massive Sports Betting Haul,Jason Kelly Michael Barr Mike Lynch follow money world sports taking listeners inside decisions that power multibillion dollar industry
sports betting,2023-02-11,The Guardian,Aucunrisque sees off Filey Bay to win Betfair Hurdle at Newbury,Schofield rides winner Europe richest handicap hurdle Zanza Funambule Sivola also victorious meeting Aucunrisque chance trained Chris Gordon held late challenge Filey warm favourite under
sports betting,2023-02-15,Deadspin,Are the Dallas Cowboys really America s Team or just popular with gamblers,study Ohio Sports Betting researched most popular teams country state Dallas Cowboys whopping margin overwhelming team choice states This study based Google search data collected over last
sports betting,2023-02-13,The Guardian,Talking Horses Bumpy ride ahead for latest attempt to impose whip rules,Expecting jockeys change habits riding lifetime heading into cauldron Cheltenham next month huge askBritish racing latest attempt impose once rules whip began Monday Catterick Plumpton Wolverhampto
sports betting,2023-02-02,Phys.Org,How legalized sports betting has transformed the fan experience,couple days before Christmas went Nashville Predators play their home against defending Stanley champion Colorado Avalanche
sports betting,2023-02-01,CNET,Watch Super Bowl Ads Before the Big Game Everything Released So Far CNET,already watch bunch them including Budweiser Doritos that Breaking commercial
sports betting,2023-01-25,The Guardian,Gambling ads and the NHL should Gretzky and McDavid do better,first edition monthly column look concerns around gambling endorsements hockeyThe advert begins small hockey arena Edmonton Oilers captain Connor McDavid sticks around after practice take multiple shots nameless
sports betting,2023-02-13,Yahoo Entertainment,Rally by Mahomes Chiefs fuels comeback for sportsbooks,When Patrick Mahomes rallied Kansas City Chiefs Super Bowl victory Sunday night also comeback sportsbooks Kansas City
sports betting,2023-02-13,Bleacher Report,King NFL Working on Low Latency Broadcast to Assist Betting on Props During Games,reportedly working make instantaneous betting easier fans watching games television ProFootballTalk
sports betting,2023-02-08,Bloomberg,MA Rep Jeffrey Turco and Bad Betting,Baystate Business Hour
sports betting,2023-01-20,Deadspin,NCAA to Congress Stop us before we NIL again,NCAA needs reality check This week vanishingly relevant college athletics institution once again asked Congress help stabilize college sports system unless Hunter Biden suiting linebacker next season
sports betting,2023-02-02,FOX 5 NY,Betting on weather takes off,Betting weather takes First column story link Drudge Report Feed needs your support Become Patron
sports betting,2023-01-27,ESPN,Mahomes status triggers fluid AFC title game line,Kansas City went from favorite underdog back favorite during week with each update Chiefs quarterback Patrick Mahomes injured ankle triggering rushes money either team
sports betting,2023-02-07,The Wall Street Journal,Betting Projected to Hit Record B,Betting Projected Record Second column story link Related stories Mahomes Hurts aware significance this Super Bowl duel
sports betting,2023-01-31,Bleacher Report,Super Bowl Odds Chiefs Bills ers Eagles Favored Cowboys in Top for,Kansas City Chiefs have opened slight betting favorites Super BowlLVIII next season reigning champions
sports betting,2023-02-12,Bleacher Report,Former MLB OF Yasiel Puig Facing New Obstruction of Justice Charge in Gambling Probe,Former Major League Baseball outfielder Yasiel Puig facing obstruction justice charge related involvement illegal sports gambling
sports betting,2023-02-15,Bloomberg,Sportradar CEO Carsten Koerl Bets Big on Sports Data Podcast,Jason Kelly Michael Barr Mike Lynch follow money world sports taking listeners inside decisions that power multibillion dollar industry
sports betting,2023-02-11,Gothamist,Betting on the Super Bowl in NY Why you can t wager on the National Anthem or Gatorade shower,This year Super Bowl could lead more legal sports betting mobile apps York largest state allow mobile betting doesn allow many obscure prop bets more
sports betting,2023-02-10,Forbes,Sports Betting Stock Eyes Superbowl Week,going week DraftKings between Super Bowl then earnings
sports betting,2023-01-18,Sports Illustrated,Dayton s Anthony Grant Slams Gamblers Who Threaten Players,Sports gambling became legal Ohio
sports betting,2023-01-20,Sports Illustrated,UFC Odds and Betting Preview Glover Teixeira vs Jamahal Hill,Best bets headlined light heavyweight title bout between Glover Teixeira betting favorite Jamahal Hill
sports betting,2023-02-01,Reuters,Breakingviews John Malone prepares for a victory lap Reuters,climb into saddle ready ride investor trail years with John Malone will appreciate saying well trip been decidedly bumpy cable cowboy Liberty Media href https reuters
sports betting,2023-02-11,Forbes,Celebrity Involvement In The Growing Sports Betting Sector,Sports betting been around almost years dating back Olympics Ancient Greece late sports betting becoming more more popular becomes fully legalized
sports betting,2023-02-07,Al Jazeera English,Eagles v Chiefs US expects record bn in Super Bowl betting,More than million people expected place bets Philadelphia Eagles battle Kansas City Chiefs this Sunday
sports betting,2023-01-31,AppleInsider,Apple won t guarantee advertising viewer counts for MLS Season Pass,Apple plans launch coverage Major League Soccer soon Apple will forgo some traditional advertising practices Season PassMajor League Soccer starts February Apple kickiing decade long relationship Fans subscribe
sports betting,2023-01-25,Biztoc.com,FanDuel Ohio brings bet get offer for NBA NHL NFL Playoffs,Sports Betting Dime provides exclusive sports betting commercial content Newsweek including real time odds picks analysis premier sportsbook offers help sports fans action Please wager responsibly Sports fans have loaded week
sports betting,2023-02-07,Bleacher Report,Survey Record M Adults Expected to Bet B on Eagles vs Chiefs Super Bowl,adult United States odds good will placing least Super Bowl survey from American Gaming
sports betting,2023-02-01,Sports Illustrated,Super Bowl LVII Rushing Props,Betting analysis various rushing props available Sportsbook Super Bowl LVII
sports betting,2023-02-07,Forbes,Mattress Mack Known For Winning Million On World Series Wager Opposes Bill Legalizing Online Sports Gambling,Online sports betting legal states Washington although opponents argue could lead gambling addiction
sports betting,2023-01-26,Biztoc.com,BetMGM bonus code NEWSWEEK activates k first bet offer for Eagles ers,Sports Betting Dime provides exclusive sports betting commercial content Newsweek including real time odds picks analysis premier sportsbook offers help sports fans action Please wager responsibly Francisco will head
sports betting,2023-02-10,Thegospelcoalition.org,The FAQs What Christians Should Know About Sports Betting,record million American adults plan this weekend Super Bowl wagering total billion What should Christians know about sports betting
sports betting,2023-01-26,NFL News,NFL Championship Sunday game picks Eagles Bengals advance to face off in Super Bowl LVII NFL com,Championship Sunday game picks Eagles Bengals advance face Super Bowl LVII conference championship game picks Sports Conference Championships Betting Guide EXPERT picks each game
sports betting,2023-02-15,Digiday,Movie trailers and sports betting delivered the most brand lift and audience in the Super Bowl,This year measurement companies drilling down determine advertising attributes from economic focus apps mentioned order divine content performed during Game
sports betting,2023-01-22,TheLines.com,NFL Divisional Round Sports Betting Promos Prescott v Purdy TheLines com,Divisional Round Sports Betting Promos Prescott Purdy TheLines divisional round playoffs odds picks Expert predictions streaming watch best bets Sports What games today
sports betting,2023-01-26,Al Jazeera English,Match fixing scandal threatens to turn snooker s boom into bust,Concerns grow over influence organised crime snooker gangs seek exploit vulnerabilities sport
sports betting,2023-01-30,Legal Sports Report,Business By The Books Sports Betting Earnings Season Heats Up Legal Sports Report,Sports betting earnings calls start earnest this week though Caesars BetMGM already gave preview what expect
sports betting,2023-01-18,Legal Sports Report,Business By The Books Kindred Cutting US Sports Betting Spend Legal Sports Report,This week column looks Kindred changing sports betting approach second time education initiatives through UNLV
sports betting,2023-02-09,Bleacher Report,Kevin Durant Trade Sees Suns Join Celtics Bucks atop New NBA Championship Odds,Phoenix Suns have become favorites come Western Conference after they reportedly landed Kevin Durant trade with Brooklyn Nets
sports betting,2023-02-02,Sky Sports,PL Predictions Havertz to fire Chelsea past Fulham,another enthralling weekend Premier League action tipster Jones Knows back with array insights analysis betting angles
sports betting,2023-01-16,ESPN,Notable bets How a million bet to win sparked debate,David Purdum recaps betting action from this weekend including million dollar that shocked community
sports betting,2023-01-20,Motley Fool,Shake Ups in Sports Broadcasting,Sports media everything Thursday golf fundraising Saudi Arabia Shaq pickleball Saudi Arabian golf league that earned
sports betting,2023-01-19,Bloomberg,Courtside Ventures Starts Million Fund to Focus on Sports Startups,Fund targeting countries that have large sports fanbases with smartphones
sports betting,2023-02-10,NFL News,WEEKEND Mahomes Hurts chasing greatness while honoring past Black QBs,WEEKEND Mahomes Hurts chasing greatness while honoring past Black Second column story link Related stories RIHANNA SUPER BOWL SETLIST CHANGED TIMES Simulation Shows EAGLES Winning Philly docs brace
sports betting,2023-02-11,Associated Press,Super Bowl ads keep it light by using nostalgia and stars,Super Bowl keep light using nostalgia stars Second column story link Related stories WEEKEND Mahomes Hurts chase greatness Simulation Shows EAGLES Addiction experts fear sports betting next
sports betting,2023-02-15,Forbes,Casinos Raked In Record Shattering Billion In Revenue Last Year,Traditional casino plays like slots still dominate market sports betting explosion shaking legal gambling business
sports betting,2023-01-26,The New Republic,Gambling Is Ruining the NFL for Fans Blame Chris Christie,There shortage good storylines National Football League playoffs this season Patrick Mahomes fighting back from recent injury attempt second Super Bowl with Kansas City Chiefs Burrow Cincinnati Bengals
sports betting,2023-01-17,Sports Illustrated,Brett Maher s Four Missed Extra Points Were Significant in the Betting World,Angry bettors wild tweets about awful performance Cowboys kicker
sports betting,2023-02-10,Axios,This year s Super Bowl is the first in a state with legal sports betting,Data American Gaming Association Cartogram Axios VisualsFor first time ever Super Bowl being held state where sports betting legal stadium with sportsbook matters milestone game State Farm Stadium
sports betting,2023-02-11,Time,Here s Your Guide to the Super Bowl,Super Bowl between Philadelphia Eagles Kansas City Chiefs rapidly approaching Here some things know ahead Sunday game
sports betting,2023-01-30,Sports Illustrated,Super Bowl LVII MVP Odds,Eagles quarterback Jalen Hurts Sportsbook favorite named Super Bowl LVII
sports betting,2023-02-09,Fox Sports,Why Chiefs Eagles will make Super Bowl sports betting history,Patrick Everson writes Sunday will monumental moment betting history Oddsmakers talent share thoughts Super Bowl being legalized sports betting state first time
sports betting,2023-02-06,Fox News,Most viral Super Bowl LVII ads,Super Bowl time amazing commercials Kurt CyberGuy Knutsson lists some from teasers full versions that going viral this year
sports betting,2023-02-07,Biztoc.com,Super Bowl sports betting turf war means hard yards for investors,major gambling groups need more states legalise sports wagers become profitable
sports betting,2023-01-23,ESPN,Notable bets How two hours of Bengals bets shifted AFC Championship Game line,David Purdum recaps betting action from this weekend playoffs including lookahead line movement Championship Game
sports betting,2023-01-27,Bloomberg,MA Representative Jake Auchincloss Donut Troubles,Baystate Business Hour
sports betting,2023-02-07,Dailyinfographic.com,Review of the Mobile Application for Betting and Casino Bluechip,Bluechip Review Bluechip fairly online casino betting facility India which began operating betting company offers wide range casino games with live dealers online sports betting betting television programs
sports betting,2023-01-27,ESPN,NBA roundtable All Star starters surprises snubs and reaction,were biggest surprises snubs this year Star game voting panel breaks down
sports betting,2023-01-26,Fox Sports,Best conference championship betting trends Mahomes Purdy Shanahan and more,Betting Niners Eagles Bengals Chiefs Sports research into various conference championship betting trends give edge Sunday
sports betting,2023-02-15,Ritholtz.com,Wednesday AM Reads,week morning train reads Markets Uncertain Forecasters Hall Fame Zero Members given year someone simply volume forecasts right have anyone repeatedly accurately forecast market
sports betting,2023-02-16,The Guardian,XFL can Dwayne The Rock Johnson make spring football work,More than decades after first incarnation imploded latest attempt spring football league kicks this weekend Will manage pull fans starred updates Baywatch Smart Rock some experience quest
sports betting,2023-01-18,BBC News,Ten Chinese snooker players charged with match fixing,Chinese players charged with match fixing snooker governing body investigates sport biggest corruption scandal
sports betting,2023-01-18,Sports Illustrated,Jaguars Chiefs AFC Divisional Round Odds Lines Spread and Best Bet,best Saturday divisional round matchup between seeded favored Chiefs Jaguars
sports betting,2023-01-25,The Athletic,NFL playoffs Key matchups in Bengals Chiefs AFC Championship Game The Athletic,playoffs matchups Bengals Chiefs Championship Game Athletic Chiefs Bengals betting line shift takes Vegas surprise That just doesn happen Kansas City Star Bengals Chiefs Prediction Odds Recent
sports betting,2023-02-10,Grid.news,Crypto Super Bowl Commercials Ruled In Not So Much In,There only certainties this year Super Bowl Eagles will play Chiefs there will crypto commercials
sports betting,2023-01-26,Forbes,NFL Playoffs Conference Championship Odds Picks And Betting Breakdown,This weekend conference championship games will generate huge watch wager action Francisco Philadelphia Cincinnati Kansas City have tight lines betting interest Conference championship odds picks betting insight with
sports betting,2023-02-08,Forbes,NFL Could UpEnd Diamond Sports Group Chapter Bankruptcy Plans,nation largest owner regional sports networks RSNs Diamond Sports Group reportedly planning file Chapter bankruptcy reorganization large part cord cutting cord shaving
sports betting,2023-01-20,ESPN,Commanders open st sportsbook in NFL stadium,Washington Commanders opened first sportsbook inside stadium Friday after receiving approval from Maryland State Lottery Gaming Control Commission August
sports betting,2023-01-19,Columbia.edu,There are five ways to get fired from Caesars theft sexual harassment running an experiment without a control group keeping a gambling addict away from the casino refusing to promote gambling to college students,this story horrible starts innocuously enough with some boardroom shenanigans September official Michigan State University athletic department sent email boss with exciting news online betting company willin
sports betting,2023-02-14,Inside Higher Ed,Sports betting contracts should be rethought opinion,When intercollegiate athletics goes from sports page front page news always good news Nowhere this been more evident than article York Times College Sports Betting Companies Caesarized
sports betting,2023-02-01,Fox Sports,NFL odds Tom Brady s career from a sports betting perspective,Brady announced retirement Wednesday Read here take look legendary quarterback career from betting perspective
sports betting,2023-02-12,Fox Sports,Super Bowl odds How professionals are betting Chiefs Eagles,Sports Betting Analyst Panayotovich looks professional bettors wagering Chiefs Eagles Super Bowl Sports
sports betting,2023-01-25,The Athletic,Four lessons the Chiefs have learned in their previous losses to Bengals The Athletic,Four lessons Chiefs have learned their previous losses Bengals Athletic Chiefs Bengals betting line shift takes Vegas surprise That just doesn happen Kansas City Star Cincinnati Bengals fans prepare
sports betting,2023-02-09,Forbes,Pete Rose Says Hopes Of Reinstatement And Cooperstown Plaque Have Greatly Diminished,Rose received lifetime from sport betting baseball games
sports betting,2023-02-10,Fox Sports,Super Bowl odds How professionals are betting Chiefs Eagles,Sports Betting Analyst Panayotovich looks professional bettors wagering Chiefs Eagles Super Bowl Sports
sports betting,2023-01-26,Sports Illustrated,Bengals Chiefs AFC Championship Game Player Props to Target,Target these three player props Sunday championship game between Bengals Chiefs including elite pass catchers
sports betting,2023-01-18,Al Jazeera English,Ten Chinese snooker players hit with match fixing charges,Governing body suspends some sport biggest names ahead formal hearing
sports,2023-01-17,The Verge,Chevy Corvette E Ray first ride iconic sports car look with an electric surge,Chevy revealed Corvette first sports from iconic brand include hybrid electric motor wheel drive
sports,2023-02-09,BBC News,Indigenous sports wow crowds at Arctic Winter Games,Alaskan high kick stick pull kneel jump were among competitive games Canada this year
sports,2023-02-09,Engadget,How to watch Super Bowl,estimated thirds population watched Super Bowl last year didn even have Rihanna Super Bowl will take place Glendale Arizona State Farm Stadium Sunday February with kick time Mountain
sports,2023-01-27,CNN,Ukraine could boycott Olympics if Russians allowed back says sports minister,Ukraine would rule boycotting Olympic Games Russian Belarusian athletes allowed compete Paris Games sports minister said
sports,2023-02-09,CNN,Florida High School Association holding emergency meeting to reconsider the mandatory reporting of athletes menstruation history,governing body Florida high school athletics holding emergency meeting Thursday reconsider proposal that would require athletes submit details their menstrual cycles medical forms needed participation school sports
sports,2023-01-27,Engadget,Apple Watch can now be used by pro surfers during competition,surfers will soon start using Apple Watch during competitions World Surf League designated wearable official wearable equipment organization says first time that Apple Watch being used official competitor
sports,2023-01-27,Entrepreneur,WSC Sports Was Built on a Love for Sports It Changed The Entire Game,Sports revolutionized sports highlights created distributed consumed
sports,2023-02-02,Reuters,JD Sports new CEO Schultz lays out growth plans Reuters,British sports fashion retailer Sports href https reuters companies target blank laid growth plan next five years which includes adding stores annually under strategy being presented
