LABEL,Date,Source,Title,Headline
sports business,2023-02-10,The Guardian,Zelenskiy Russia s return to Olympics would be manifestation of violence,Ukraine president spoke summit sports ministers Terror Olympism opposites they cannot combined Russia presence next year Paris Olympics would manifestation violence Ukraine president Volody
sports business,2023-02-10,Business Insider,A record number of Americans are betting on the Super Bowl this year,Sports betting companies could real winners Super Bowl Sunday over million people projected wager game
sports business,2023-01-31,Reuters,Analysis Italy promotes short term job market shunning Spain s Reuters,Marta Pizza year swimming instructor worked Rome sports centre last years earning euros hour with pension contributions sick holidays
sports business,2023-02-10,BBC News,Tech layoffs Yahoo to slash of its workforce,Yahoo adds growing list tech companies cutting jobs consumer corporate spending shrink
sports business,2023-01-18,Reuters,Explainer Jim Ratcliffe who is the INEOS founder bidding for Reuters,INEOS company owned Ratcliffe British billionaire long time Manchester United formally entered href lifestyle sports ineos enters bidding process manchester united times bidding process Prem
sports business,2023-02-16,The Guardian,The best coaches are thieves stealing ideas from others to stay at the top of their game Karen Carney,Watching England Nations reminder much football learn from rugby cycling othersThe ball sent long launched right boot hope getting team other pressure opposition defenders Posse
sports business,2023-02-08,The Guardian,UK housing market sees marked slowdown as recession fears ebb business live,Rolling coverage latest economic financial news housebuilder Barratt says economic backdrop clearly been challenging households suffer blow finances this year says report Charlie Huggins Head Equities
sports business,2023-02-01,Reuters,Disney argues TV streamers antitrust lawsuits over ESPN Reuters,Lawyers Walt Disney Tuesday asked judge dismiss pair consumer antitrust cases alleging media entertainment company business contracts have artificially driven costs rival video streaming services YouTube
sports business,2023-01-21,The Guardian,Netflix s Reed Hastings changed the way we watch TV for better or for worse,departing humble company soared stunning success paved imitatorsPerhaps nothing sums legacy Netflix founder Reed Hastings neatly certain Pepper commercial second spot staple live sports
sports business,2023-01-18,Business Insider,I quit the NFL to trade Pok mon cards I was making just as much playing football so I decided to do something I love,Blake Martinez trades cards through livestream shopping platform Whatnot told Insider quit focus business
sports business,2023-01-17,Reuters,India s Network posts quarterly loss on expenses ad slowdown Reuters,India Network Media Investments href https reuters companies NEFI target blank NEFI reported third quarter loss Tuesday billionaire Mukesh Ambani backed conglomerate splurged push share television
sports business,2023-01-17,DallasCowboys.com,Game Recap Dak Defense Dominate in Win DallasCowboys com,Game Recap Defense Dominate DallasCowboys masterclass Prescott poised execution from pocket with ESPN Brett Maher finally makes extra point Cowboys lead Sports
sports business,2023-02-01,Reuters,Brady s broadcasting future presents new challenge for the ultimate Reuters,Brady ultimate winner field that success does guarantee seven time Super Bowl champion will make seamless transition when steps into booth begin role lead analyst
sports business,2023-02-09,Business Insider,Disney CEO Bob Iger says ESPN will one day be streaming only,ESPN current streaming service ESPN ended with million subscribers company announced Wednesday earnings call
sports business,2023-01-24,Entrepreneur,After He Was Fired From The UFC This Former Fighter Turned His Passion Into a Thriving Business,When Eliot Marshall lifelong dream fell through used knowledge trained fighter build thriving chain jitsu gyms
sports business,2023-01-17,Deadline,Disney Skewers Nelson Peltz As Lacking Skills And Experience To Assist Board Reveals Marvel Chair Isaac Perlmuttter Backed Activist Investor Deadline,Disney Skewers Nelson Peltz Lacking Skills Experience Assist Board Reveals Marvel Chair Isaac Perlmuttter Backed Activist Investor Deadline LPTV Disney Morning News Update Disney Responds Meeting with Josh
sports business,2023-01-19,The Guardian,Lloyds Pharmacy to close all Sainsbury s outlets,Group says move changing market conditions industry warns insufficient government fundingLloyds Pharmacy closing outlets Sainsbury supermarkets amid fears insufficient government funding industry group
sports business,2023-01-19,The Guardian,Deloitte reveal more than half of world s richest clubs are in Premier League,Eleven clubs from England according annual list Manchester City list Liverpool four places third first time history more than half world richest clubs from Premier League
sports business,2023-01-21,The Guardian,The fate of golf s European Tour appears to be in the eye of the beholder Ewan Murray,rise Golf presents threat state establishment appears vary depending askedThe absence Keith Pelley World Tour year under Dhabi this week explained himself note playe
sports business,2023-02-16,The Guardian,Five factors to explain FTSE s record high despite recession,Economy business backdrop grim energy boom shareholder payouts have helpedLondon blue chip share index FTSE time high over points Thursday FTSE strong when economy expe
sports business,2023-01-26,Business Insider,Meet Thom Browne the stripe obsessed designer who took on Adidas and won,Born Allentown Pennsylvania Browne opened first store York City with five made measure grey suits
sports business,2023-02-02,Business Insider,A shortage of accountants is pushing the industry to reboot its image to win over young talent You have to sell them,accounting profession long suffered from image issues Colleges major firms hope some changes will attract demographic
sports business,2023-01-17,The Washington Post,Tom Brady s future is about to get awkward The Washington Post,Brady future about awkward Washington Post Brady sounds less like taken last snap more like uncertain where next will Yahoo Sports Brady Veronika Rajek Pumped
sports business,2023-01-17,The Guardian,Polestar boss Thomas Ingenlath s drive for a truly emission free car,Swedish based electric carmaker pulled ahead rivals thanks factory model Chinese partner boss want remove carbon from production process never ever that interested designing Ferrari
sports business,2023-02-07,The Guardian,McDonald s signs legal pledge amid UK sexual harassment concerns,Agreement with Equality Human Rights Commission commits firm number measures protect workersMcDonald signed legally binding pledge with equality watchdog amid concerns over handled sexual harassment complaints made
sports business,2023-02-07,The Guardian,McDonald s signs legal pledge amid UK sexual harassment concerns,Agreement with Equality Human Rights Commission commits firm number measures protect workersMcDonald signed legally binding pledge with equality watchdog amid concerns over handled sexual harassment complaints made
sports business,2023-02-10,ABC News,Yahoo to lay off of its workforce by the end of the year,Yahoo will workforce year including employees this week part restructuring tech division company said
sports business,2023-02-02,The Guardian,F teams hold right of veto over any new entrants to the grid FIA confirms,open process applications join Formula Existing teams will given priority over applicants publicly conceded that entrants Formula will still dependent permission
sports business,2023-02-16,Digital Trends,MLS Season Pass will be available to sports bars and the like,prefer watch your favorite team from comfort your favorite sports Season Pass will available
sports business,2023-01-21,The Guardian,Memes to dreams viral Popeyes boy finally reaps reward of online fame,Dieunerst Collin became internet famous child video fast food chain signs advertising deal with companyA decade passed last star internet meme showing glancing sideways confusion with hand
sports business,2023-02-15,The Guardian,Thom Browne shoots wearability to the moon at Little Prince inspired New York show,Fashion designer ignores trend towards ordinary first outing since winning four stripes case against AdidasChatter York fashion week about something from remarkable return ordinary wearable clothes catwalk rather than
sports business,2023-02-12,Digital Trends,Why aren t sports in K and HDR It s harder than you think,gotten used steady diet content sports rare treat indeed look live sports harder than think
sports business,2023-01-20,Entrepreneur,Sauna Village Anyone The Great Northern Festival Wants to Make Cold Weather Cool,Twin Cities will host immersive event featuring activities inspire awareness action around winter
sports business,2023-01-23,The Guardian,World Athletics transgender regulations see scientific rigour give way to a fudge Sean Ingle,Sebastian promised guided science when comes sport most divisive issue World Athletics solution clearly designed protect from legal action tooNo female athlete commented blame them given vicious amoun
sports business,2023-02-16,The Guardian,LIV Golf s honeymoon period may be hurtling towards a tangled conclusion Ewan Murray,four time major winner like Brooks Koepka pondering what earth doing Tour should beEstablishing precise thoughts Brooks Koepka knotty business This individual prior last year Open barked
sports business,2023-01-27,Deadspin,Women s sports get six minutes of coverage on ESPN and a conservative journo says there s a feminist agenda,Here Again Women sports given media coverage feel need make sure know cares about women sports Women sports aren interesting sports better Women deserve media coverage Read more
sports business,2023-01-31,The Guardian,Chinese owner of Lotus Technology to list a stake in US via blank cheque firm,maker group owned Geely planning join Nasdaq deal with Spac backed Bernard ArnaultThe Chinese owner Lotus list stake division luxury sports group part deal with firm backed
sports business,2023-01-30,Theregister.com,JD Sports admits intruder accessed million customers data,payment details exposed breach says retailer shoppers told vigilant about potential scams Sports fashion retailer Sports confirmed miscreants broke into system that contained data whopping million customers payment
sports business,2023-02-01,Reuters,Good summer planning means no need for January spending says Reuters,Real Madrid good shape need spend January transfer window unlike clubs Premier League manager Carlo Ancelotti said Wednesday
sports business,2023-02-12,The Guardian,Russia Ukraine war latest updates Ukraine forces hold frontline in Donetsk Kyiv s top military commander says,Valeriy Zaluzhnyi says forces continued hold besieged town Bakhmut fierce battles rage cities Vuhledar Maryinka glance what know Russia invasion Continue reading
sports business,2023-01-20,Slate Magazine,Think You re Smarter Than a Slate Senior Editor Find Out With This Week s News Quiz,Test your knowledge this week stories
sports business,2023-02-10,MarketWatch,MemeMoney As Super Bowl nears Stocktwits CEO highlights huge overlap between sports betting and meme stocks,Americans likely spend some billion betting Sunday game between Kansas City Chiefs Philadelphia Eagles
sports business,2023-01-27,Business Insider,See the wild Nike memo that calls personal ambition a danger and urges workers to fight the law,Nike executive Strasser dashed memorable list principles that captured company irreverent early days
sports business,2023-02-03,CNET,Apple s iPhone and Mac Sales Boom During the Pandemic Has Hit a Snag CNET,Apple latest tech giant report economic struggles across tech industry
sports business,2023-01-24,Entrepreneur,Why a Proper Digital Marketing Strategy Is a Financial Advisor s Secret Weapon,With digital marketing full swing financial advisors have choice represented advertise online Digital marketing financial advisor friend here
sports business,2023-02-04,ESPN,QB Smith on Seahawks talks Looking very good,Geno Smith said Friday that contract talks with Seahawks underway prospects sides reaching deal looking very good
sports business,2023-02-05,BBC News,Bageshwar Dham Sarkar The Indian guru making headlines over miracle cures,Bageshwar Dham Sarkar supporters claim divine powers heal sick read people minds
sports business,2023-02-01,Motley Fool,Could Big Tech Drive ESPN Out of Business,worldwide leader sports some deep pocketed competition
sports business,2023-01-27,Bloomberg,Bloomberg Daybreak Weekend Rates China DocuDrama Podcast,Hear breaking economic business market news well global national local news sports
sports business,2023-02-01,Bloomberg,Bloomberg Daybreak February,Hear breaking economic business market news well global national local news sports
sports business,2023-01-30,Bloomberg,Bloomberg Daybreak January Podcast,Hear breaking economic business market news well global national local news sports
sports business,2023-02-08,Bloomberg,Jeers for Biden and Banker Bonus Woes Podcast,Hear breaking economic business market news well global national local news sports
sports business,2023-02-09,Bloomberg,Disney Surges and Credit Suisse Tumbles Podcast,Hear breaking economic business market news well global national local news sports
sports business,2023-02-10,Bloomberg,UK Avoids Recession and Tech Layoffs Continue Podcast,Hear breaking economic business market news well global national local news sports
sports business,2023-02-03,Bloomberg,Apple Amazon Fall and Zuckerberg s Big Day Podcast,Hear breaking economic business market news well global national local news sports
sports business,2023-01-26,Bloomberg,Bloomberg Daybreak January,Hear breaking economic business market news well global national local news sports
sports business,2023-02-10,Bloomberg,UK Avoids Recession and Tech Layoffs Continue Podcast,Hear breaking economic business market news well global national local news sports
sports business,2023-01-25,Bloomberg,Bloomberg Daybreak January,Hear breaking economic business market news well global national local news sports
sports business,2023-01-17,Bloomberg,Bloomberg Daybreak January Hour Radio,Hear breaking economic business market news well global national local news sports
sports business,2023-01-27,Bloomberg,Bloomberg Daybreak January,Hear breaking economic business market news well global national local news sports
sports business,2023-02-01,The Guardian,La Liga chief attacks Premier League doped market as Europe is left behind,English flight clubs January record Chelsea outspent total clubs other five leagues president Liga described Premier League doped market after clubs smashed record
sports business,2023-01-29,The Guardian,Nepo babies claim their parentage is overblown Truth is they re helped all the way Martha Gill,From Kaia Gerber Lily Rose Depp celebrity offspring making mockery meritocracyWhy outraged nepo babies This question particular interest nepotism babies themselves since recent York magazine article chil
sports business,2023-01-23,The Guardian,Talking Horses Online punters should beware the devil in the detail,level protection your money lack often hidden when signing accountsSome punters will have been crossing days this year Cheltenham Festival March since Saturday morning after last
sports business,2023-02-03,The Guardian,Slowing economic growth and a FTSE record high can coexist here s how,blue chip Footsie closed time high while economy shrink Full story FTSE hits record high message workers doom loop wealth boom loop will only country econo
sports business,2023-01-16,TMZ,Rich Paul Urging Pro Tennis Players To Switch To Pro Pickleball After MLP Investment,Listen tennis players Rich Paul offering some free business advice explaining Sports believes career switch pickleball could yield huge benefits athletes they officially traded rackets paddles Paul
sports business,2023-02-13,Bloomberg,The US and China Spar Over Suspected Balloons Podcast,Hear breaking economic business market news well global national local news sports
sports business,2023-02-16,Bloomberg,Airbnb CEO on Record Earnings and Cisco Shares Surge Podcast,Hear breaking economic business market news well global national local news sports
sports business,2023-02-16,Bloomberg,Radio,Hear breaking economic business market news well global national local news sports
sports business,2023-01-18,Business Insider,I drove electric SUVs from Kia Hyundai and Tesla and I see why the Korean brands are gaining on Elon Musk,Ioniq deliver head turning style cool features great driving range wonder they some trendiest Tesla rivals
sports business,2023-01-27,Entrepreneur,Petty And Vindictive Behavior Madison Square Garden CEO James Dolan Defends Kicking Out Lawyers Who Work For Firms Involved With Lawsuits Against The Venue,private venue receives estimated million through break
sports business,2023-02-01,Time,Tom Brady Says He s Retiring for Good Here s a Short Timeline of His NFL Career,After completing season year sporting titan marked career with short video social media
sports business,2023-02-01,Ctvnews.ca,Six ways the city of Ottawa s budget will affect your wallet CTV News Ottawa,ways city Ottawa budget will affect your wallet News Ottawa OTTAWA BUDGET Sutcliffe unveils tight draft budget with priority investments efficiencies Ottawa Citizen Ottawa budget City table
sports business,2023-02-16,Business Insider,WallStreetBets founder is suing Reddit over ousting him from the meme stock forum reportedly saying he wants million after the nightmare ban,WallStreetBets founder Jaime Rogozinski says social media giant Reddit ousted moderator take control meme stock forum
sports business,2023-02-03,Bloomberg,A Look at Tom Brady s Legacy and Future in Business Podcast,Jason Kelly Michael Barr Mike Lynch follow money world sports taking listeners inside decisions that power multibillion dollar industry
sports business,2023-01-25,Small Business Trends,Manufacturing Business Ideas to Start in,looking business venture consider these manufacturing business ideas
sports business,2023-02-08,Bloomberg,MA Rep Jeffrey Turco and Bad Betting,Baystate Business Hour
sports business,2023-02-09,Business Insider,Here are fun details that you might miss in the trailer for Air the Ben Affleck and Matt Damon movie about Nike signing Michael Jordan,movie which releases April includes several nods Nike rich corporate history including joke about cofounder Phil Knight driving
sports business,2023-01-31,Entrepreneur,Out With the Kibble and In With the Steak The World s Richest Dog Has a Net Worth of Million And a New Netflix Docuseries Too,Gunther Millions unpack pooch mysterious fortune what those around have done with inheritance
sports business,2023-02-10,ReadWrite,Seeing Double with Digital Twin Security Concerns,benefits digital twins defined Gartner digital representation real world entity system tremendous particularly when coupled with augmented reality virtual reality innovations example manufacturing sector
sports business,2023-02-14,ReadWrite,Harnessing Tech Trends Through Custom Software Design and Development,Technology advances furious pace these days Innovative software products hardware devices conceived daily connect increasingly digital world further organizations across industries struggling keep Once thought simply
sports business,2023-01-31,Business Insider,Kucoin Review,Global exchange Kucoin offers over cryptocurrencies multiple payment options NFTs traders only limited access
sports business,2023-01-20,Entrepreneur,Reasons Why Critical Decisions Require In Person Connection,human beings with emotions passions goals When comes making decisions here integrity handshake power looking someone connection sharing meal drink with someone cannot happen over virtu
sports business,2023-02-15,Bloomberg,Super Bowl s Massive Sports Betting Haul,Jason Kelly Michael Barr Mike Lynch follow money world sports taking listeners inside decisions that power multibillion dollar industry
sports business,2023-02-08,Yanko Design,Enchanting TV concept transforms from regular TV to gaming by pushing the screen forward,Enchanting concept transforms from regular gaming pushing screen forwardGaming always been lucrative business come under spotlight lately certain global events Even those wouldn label
sports business,2023-02-01,Reuters,Breakingviews John Malone prepares for a victory lap Reuters,climb into saddle ready ride investor trail years with John Malone will appreciate saying well trip been decidedly bumpy cable cowboy Liberty Media href https reuters
sports business,2023-01-27,Bloomberg,MA Representative Jake Auchincloss Donut Troubles,Baystate Business Hour
sports business,2023-02-15,Forbes,Inside Athletic Brewing s Plan To Make Boozeless Beer A Billion Dollar Business,Bill Shufelt John Walker Making Nonalcoholic Beers Tasty Enough Please Biggest Snobs With Nearly Million Valuation Investors Intoxicated
sports business,2023-01-19,ESPN,Gronk Mindset wasn t there despite teams calls,Gronkowski said couple teams called gauge interest playing that mindset wasn there
sports business,2023-01-27,ESPN,Ladies first Iowa s Mir lands UFC s first NIL deal,Bella daughter former heavyweight champion Frank freshman wrestler University Iowa landed first name image likeness deal awarded mixed martial arts promotion
sports business,2023-02-14,9to5Mac,Apple expressed interest in NBA streaming rights but can t make formal bid,report says that Apple expressed interest acquiring streaming rights Apple existing agreements mean that cannot make formal Disney ESPN currently holds exclusive rights National Basketball Association games
sports politics,2023-01-27,The Guardian,Donald Trelford obituary,Editor Observer fought retain paper integrity identityDonald Trelford died from cancer aged edited Observer world oldest Sunday newspaper years from while fighting much
sports politics,2023-02-08,Boing Boing,Kareem is thrilled that LeBron broke his NBA scoring record,LeBron James recently broke Kareem Abdul Jabbar scoring record Check this video moment happened shared Dwyane Wade Folks over Twitter celebrated accomplishment pointed coincidental involved Ashley
sports politics,2023-02-10,ESPN,Zelenskyy No place for Russia at Paris Games,Russian athletes have place next year Paris Olympics while their country invasion Ukraine continues Ukrainian President Volodymyr Zelenskyy told summit sports officials from about countries
sports politics,2023-01-31,NPR,Former U S Sen David Durenberger of Minnesota dies at,Minnesota Republican served three terms championed health care reform protecting rights disabled people including landmark Americans with Disabilities
sports politics,2023-01-18,The Guardian,If you had money you had slaves how Ethiopia is in denial about injustices of the past,Many feel Ethiopia slave owning traditions which lasted into last century align with country modern image itselfNothing hints dark past marketplace Dalbo town southern Ethiopia Today thriving
sports politics,2023-02-13,The Guardian,Czech Republic s Jakub Jankto coming out will inspire people in the game,Holmes LGBT advocate says message Sparta Prague midfielder broken mould created Jakub Jankto coming video been watched million times Twitter within four hours being uploaded Instagram received
sports politics,2023-01-20,The Guardian,DeSantis v NHL Florida governor targets unlikely foe in anti woke crusade,What does Florida governor Republican presidential hopeful look gain from attacking North America whitest sports league woke part forthcoming Star game weekend Sunrise Florida National Hockey League planned host
sports politics,2023-01-20,Slate Magazine,Think You re Smarter Than a Slate Senior Editor Find Out With This Week s News Quiz,Test your knowledge this week stories
sports politics,2023-01-27,The Guardian,Polarising Novak Djokovic is set to complete extraordinary revenge arc Barney Ronay,year scything through Australian Open haze righteous fury after being deported year agoThere familiar pitch noise from crowd Novak Djokovic emerged Melbourne Park Friday walk himself through
sports politics,2023-02-09,The Guardian,Could Russia really quit Uefa for Asian federation to reach World Cup,Russia weighing following Australia example joining qualification route significant obstacles remainIf there road Russia World eastwards from Moscow through Asia result inva
sports politics,2023-01-25,Time,Most Parents Don t Like School Culture Wars New Polling Shows,December survey from Democratic pollsters Hart Research Associates parents said culture wars distraction from schools primary mission education
sports politics,2023-02-09,The Guardian,Alex Morgan rips bizarre potential Saudi sponsorship of Women s World Cup,star expresses support transgender kids sports Morgan criticizes potential Saudi sponsorship World ranked Americans kick SheBelieves next week Forward Alex Morgan says national team should
sports politics,2023-01-17,HuffPost,Australian Open Bans Flags From Russia Belarus After Fans Bring Them Courtside,Russian flag show during Ukraine Kateryna Baindl victory over Russia Kamilla Rakhimova Another offered Russia Daniil Medvedev sign
sports politics,2023-02-09,The Guardian,Florida cuts humiliating questions about school athletes menstrual histories,Questions were required order participate sports Some believe questions were connected trans issues Questions about female athletes menstrual history will longer appear medical forms that Florida high school
